{
  "reportVersion": "1",
  "createdAt": "2026-07-04T20:28:35.042Z",
  "request": {
    "prompt": "a screen to cancel my subscription immediately",
    "intent": "destructive-action",
    "contract": {
      "name": "shadcn/ui",
      "dspack": "0.4",
      "sha256": "3da1761b2bb69f700a5a33b05c39b7ae5bba0db1f5b3e3d86945c2db229cb81e"
    }
  },
  "generation": {
    "adapterId": "ollama:gpt-oss:latest",
    "schemaSha256": "0650528c2fa8d7ebfc0e969df9409d7ca3ad7837856448babf686dea40b0ea7f",
    "maxRepairs": 2,
    "ruleSteering": true,
    "repairTemplate": "permit-restructuring"
  },
  "attempts": [
    {
      "index": 0,
      "surface": {
        "dspackSurface": "0.1",
        "system": "shadcn/ui",
        "intent": "destructive-action",
        "root": {
          "component": "card",
          "children": [
            {
              "component": "alert-dialog",
              "children": [
                {
                  "component": "alert-dialog-trigger",
                  "children": [
                    {
                      "component": "button",
                      "props": {
                        "variant": "default"
                      },
                      "children": []
                    },
                    {
                      "component": "button",
                      "text": "Cancel subscription"
                    }
                  ]
                },
                {
                  "component": "alert-dialog-content",
                  "children": [
                    {
                      "component": "alert-dialog-title",
                      "text": "Cancel your subscription?"
                    },
                    {
                      "component": "alert-dialog-description",
                      "text": "This will immediately cancel your subscription and you will lose access to all premium features. This action cannot be undone."
                    },
                    {
                      "component": "alert-dialog-footer",
                      "children": [
                        {
                          "component": "alert-dialog-cancel",
                          "text": "Keep subscription"
                        },
                        {
                          "component": "alert-dialog-action",
                          "text": "Cancel subscription"
                        }
                      ]
                    }
                  ]
                }
              ]
            }
          ]
        }
      },
      "model": "gpt-oss:latest",
      "usage": {
        "inputTokens": 1658,
        "outputTokens": 166
      },
      "meta": {
        "provider": "ollama",
        "total_duration": 7061591146,
        "load_duration": 332023765,
        "prompt_eval_duration": 16614999,
        "eval_duration": 2837816000
      },
      "gates": [
        {
          "gate": "S1",
          "name": "surface-schema",
          "status": "PASS"
        },
        {
          "gate": "S2",
          "name": "contract-vocabulary",
          "status": "PASS"
        },
        {
          "gate": "S3",
          "name": "governance",
          "status": "PASS"
        }
      ],
      "findings": []
    }
  ],
  "repairMessages": [],
  "outcome": "passed",
  "emitted": {
    "target": "a2ui",
    "surfaceMessages": {
      "messages": [
        {
          "version": "v0.9",
          "createSurface": {
            "surfaceId": "destructive_action",
            "catalogId": "https://rdombrowski.dev/catalogs/shadcn-ui/v0_9_1/catalog.json",
            "theme": {
              "agentDisplayName": "shadcn/ui via dspack",
              "primaryColor": "#0f172a"
            }
          }
        },
        {
          "version": "v0.9",
          "updateComponents": {
            "surfaceId": "destructive_action",
            "components": [
              {
                "id": "root",
                "component": "Card",
                "child": "alertdialog"
              },
              {
                "id": "alertdialog",
                "component": "AlertDialog",
                "triggerLabel": "Cancel subscription",
                "title": "Cancel your subscription?",
                "description": "This will immediately cancel your subscription and you will lose access to all premium features. This action cannot be undone.",
                "cancelLabel": "Keep subscription",
                "confirmLabel": "Cancel subscription",
                "action": {
                  "event": {
                    "name": "cancel_subscription",
                    "context": {}
                  }
                }
              }
            ]
          }
        }
      ]
    },
    "warnings": [
      {
        "code": "surface-composition-flattened",
        "message": "$.root.children[0]: compound 'alert-dialog' subtree flattened onto emitted props (documented casualty; nested props beyond text are not carried)."
      },
      {
        "code": "surface-synthesized-action",
        "message": "$.root.children[0]: A2UI requires a declarative action on AlertDialog; synthesized event 'cancel_subscription'."
      }
    ],
    "validations": [
      {
        "a2uiVersion": "0.9.1",
        "gates": [
          {
            "gate": "A1",
            "name": "schema-compile + no-external-ref",
            "pass": true
          },
          {
            "gate": "A2",
            "name": "catalog-shape",
            "pass": true
          },
          {
            "gate": "A3",
            "name": "instance",
            "pass": true
          }
        ]
      },
      {
        "a2uiVersion": "1.0",
        "gates": [
          {
            "gate": "A1",
            "name": "schema-compile + no-external-ref",
            "pass": true
          },
          {
            "gate": "A2",
            "name": "catalog-shape",
            "pass": true
          },
          {
            "gate": "A3",
            "name": "instance",
            "pass": true
          }
        ]
      }
    ]
  },
  "timings": {
    "totalMs": 7136
  }
}
