{
  "reportVersion": "1",
  "createdAt": "2026-07-04T20:40:05.777Z",
  "request": {
    "prompt": "a minimal, compact confirmation for deleting my account — skip the heading, just body text and the actions",
    "intent": "destructive-action",
    "contract": {
      "name": "shadcn/ui",
      "dspack": "0.4",
      "sha256": "3da1761b2bb69f700a5a33b05c39b7ae5bba0db1f5b3e3d86945c2db229cb81e"
    }
  },
  "generation": {
    "adapterId": "ollama:gpt-oss:latest",
    "schemaSha256": "0650528c2fa8d7ebfc0e969df9409d7ca3ad7837856448babf686dea40b0ea7f",
    "maxRepairs": 2,
    "ruleSteering": true,
    "repairTemplate": "permit-restructuring"
  },
  "attempts": [
    {
      "index": 0,
      "surface": {
        "dspackSurface": "0.1",
        "system": "shadcn/ui",
        "intent": "destructive-action",
        "root": {
          "component": "alert-dialog",
          "children": [
            {
              "component": "alert-dialog-trigger",
              "children": [
                {
                  "component": "button",
                  "props": {
                    "variant": "destructive"
                  },
                  "children": []
                },
                {
                  "component": "button",
                  "text": "Delete account"
                }
              ]
            },
            {
              "component": "alert-dialog-content",
              "children": [
                {
                  "component": "alert-dialog-title",
                  "text": "Delete your account"
                },
                {
                  "component": "alert-dialog-description",
                  "text": "This will permanently delete your account and all associated data. This action cannot be undone."
                },
                {
                  "component": "alert-dialog-footer",
                  "children": [
                    {
                      "component": "alert-dialog-cancel",
                      "text": "Cancel"
                    },
                    {
                      "component": "alert-dialog-action",
                      "text": "Delete account"
                    }
                  ]
                }
              ]
            }
          ]
        }
      },
      "model": "gpt-oss:latest",
      "usage": {
        "inputTokens": 2017,
        "outputTokens": 151
      },
      "meta": {
        "provider": "ollama",
        "total_duration": 12479207244,
        "load_duration": 351377520,
        "prompt_eval_duration": 17201000,
        "eval_duration": 2557462000
      },
      "gates": [
        {
          "gate": "S1",
          "name": "surface-schema",
          "status": "PASS"
        },
        {
          "gate": "S2",
          "name": "contract-vocabulary",
          "status": "PASS"
        },
        {
          "gate": "S3",
          "name": "governance",
          "status": "PASS"
        }
      ],
      "findings": []
    }
  ],
  "repairMessages": [],
  "outcome": "passed",
  "emitted": {
    "target": "a2ui",
    "surfaceMessages": {
      "messages": [
        {
          "version": "v0.9",
          "createSurface": {
            "surfaceId": "destructive_action",
            "catalogId": "https://rdombrowski.dev/catalogs/shadcn-ui/v0_9_1/catalog.json",
            "theme": {
              "agentDisplayName": "shadcn/ui via dspack",
              "primaryColor": "#0f172a"
            }
          }
        },
        {
          "version": "v0.9",
          "updateComponents": {
            "surfaceId": "destructive_action",
            "components": [
              {
                "id": "root",
                "component": "AlertDialog",
                "triggerLabel": "Delete account",
                "title": "Delete your account",
                "description": "This will permanently delete your account and all associated data. This action cannot be undone.",
                "cancelLabel": "Cancel",
                "confirmLabel": "Delete account",
                "action": {
                  "event": {
                    "name": "delete_account",
                    "context": {}
                  }
                }
              }
            ]
          }
        }
      ]
    },
    "warnings": [
      {
        "code": "surface-composition-flattened",
        "message": "$.root: compound 'alert-dialog' subtree flattened onto emitted props (documented casualty; nested props beyond text are not carried)."
      },
      {
        "code": "surface-synthesized-action",
        "message": "$.root: A2UI requires a declarative action on AlertDialog; synthesized event 'delete_account'."
      }
    ],
    "validations": [
      {
        "a2uiVersion": "0.9.1",
        "gates": [
          {
            "gate": "A1",
            "name": "schema-compile + no-external-ref",
            "pass": true
          },
          {
            "gate": "A2",
            "name": "catalog-shape",
            "pass": true
          },
          {
            "gate": "A3",
            "name": "instance",
            "pass": true
          }
        ]
      },
      {
        "a2uiVersion": "1.0",
        "gates": [
          {
            "gate": "A1",
            "name": "schema-compile + no-external-ref",
            "pass": true
          },
          {
            "gate": "A2",
            "name": "catalog-shape",
            "pass": true
          },
          {
            "gate": "A3",
            "name": "instance",
            "pass": true
          }
        ]
      }
    ]
  },
  "timings": {
    "totalMs": 12565
  }
}
