{
  "reportVersion": "1",
  "createdAt": "2026-07-03T16:28:37.433Z",
  "request": {
    "prompt": "a danger-zone card whose delete button contains a small confirm checkbox input inside it",
    "intent": "destructive-action",
    "contract": {
      "name": "shadcn/ui",
      "dspack": "0.3",
      "sha256": "4c86ba94156fee1754ca599435a12b8e5fc628329c4b2abe4a3d55168c908d07"
    }
  },
  "generation": {
    "adapterId": "anthropic:claude-sonnet-5",
    "schemaSha256": "0650528c2fa8d7ebfc0e969df9409d7ca3ad7837856448babf686dea40b0ea7f",
    "maxRepairs": 2,
    "ruleSteering": true,
    "repairTemplate": "standard"
  },
  "attempts": [
    {
      "index": 0,
      "adapterError": "[anthropic:claude-sonnet-5] transport failure (BadRequestError): 400 {\"type\":\"error\",\"error\":{\"type\":\"invalid_request_error\",\"message\":\"The compiled grammar is too large, which would cause performance issues. Simplify your tool schemas or reduce the number of strict tools.\"},\"request_id\":\"req_011CcfSUGHHFqes635iEZfaj\"}"
    }
  ],
  "repairMessages": [],
  "outcome": "failed-adapter",
  "timings": {
    "totalMs": 376
  }
}
