{
  "reportVersion": "1",
  "createdAt": "2026-07-03T23:20:50.833Z",
  "request": {
    "prompt": "a settings section to permanently delete a repository",
    "intent": "destructive-action",
    "contract": {
      "name": "shadcn/ui",
      "dspack": "0.4",
      "sha256": "868bec778fbcd06bf2a149e2fa191a5353b81c4a36a2138303d409f98128d657"
    }
  },
  "generation": {
    "adapterId": "ollama:qwen3.6:35b",
    "schemaSha256": "0650528c2fa8d7ebfc0e969df9409d7ca3ad7837856448babf686dea40b0ea7f",
    "maxRepairs": 2,
    "ruleSteering": true,
    "repairTemplate": "permit-restructuring"
  },
  "attempts": [
    {
      "index": 0,
      "adapterError": "[ollama:qwen3.6:35b] empty model output"
    }
  ],
  "repairMessages": [],
  "outcome": "failed-adapter",
  "timings": {
    "totalMs": 667342
  }
}
